{
  "schema_version": "0.1.0",
  "package_id": "RPK-600XXX-2026-002",
  "status": "verified",
  "as_of_date": "2026-07-10",
  "created_at": "2026-07-17T10:00:00+10:00",
  "company": {
    "name": {
      "zh_CN": "示例智能制造股份有限公司",
      "en_AU": "Example Intelligent Manufacturing Co., Ltd."
    },
    "ticker": "600XXX",
    "exchange": "MOCK",
    "market": "CN-A",
    "reporting_currency": "CNY",
    "sector": {
      "zh_CN": "工业自动化设备",
      "en_AU": "Industrial automation equipment"
    },
    "is_mock": true,
    "market_specific": {
      "cn": {
        "industry_classification_sw": "机械设备-自动化设备",
        "share_classes": [
          "A"
        ],
        "state_owned": false,
        "display_unit_convention": "亿元",
        "policy_context_claim_ids": [
          "CLM-002"
        ]
      }
    }
  },
  "sources": [
    {
      "source_id": "SRC-001",
      "type": "annual_report",
      "title": "示例智能制造2025年年度报告（虚构测试文件）",
      "publisher": "示例智能制造股份有限公司",
      "url_or_document": "upload://mock-annual-report-2025.pdf",
      "locator": "合并报表及经营讨论",
      "published_date": "2026-04-20",
      "retrieved_at": "2026-07-10T09:00:00+08:00",
      "reliability_tier": "primary",
      "language": "zh"
    },
    {
      "source_id": "SRC-002",
      "type": "market_data_api",
      "title": "Mock market data provider — daily close",
      "publisher": "MockData",
      "url_or_document": "provider://mockdata/quote/600XXX?as_of=2026-07-10",
      "locator": "close 2026-07-10",
      "published_date": "2026-07-10",
      "retrieved_at": "2026-07-10T09:00:00+08:00",
      "reliability_tier": "primary",
      "language": "en"
    },
    {
      "source_id": "SRC-003",
      "type": "regulator",
      "title": "《智能制造装备产业发展指导意见》（虚构政策文件）",
      "publisher": "示例部委",
      "url_or_document": "https://example.gov.mock/policy/2026-guidance",
      "locator": "第三节",
      "published_date": "2026-03-01",
      "retrieved_at": "2026-07-10T09:00:00+08:00",
      "reliability_tier": "primary",
      "language": "zh"
    },
    {
      "source_id": "SRC-004",
      "type": "third_party_research",
      "title": "Mock industry outlook: factory automation 2026-2030",
      "publisher": "Example Research Institute",
      "url_or_document": "https://example-research.mock/fa-2026",
      "locator": "Exhibit 4",
      "published_date": "2026-05-15",
      "retrieved_at": "2026-07-10T09:00:00+08:00",
      "reliability_tier": "secondary",
      "language": "en"
    },
    {
      "source_id": "SRC-005",
      "type": "third_party_research",
      "title": "Mock comparable-company dataset (fictional peers)",
      "publisher": "Example Research Institute",
      "url_or_document": "https://example-research.mock/comps-2026",
      "locator": "Table 2",
      "published_date": "2026-06-30",
      "retrieved_at": "2026-07-10T09:00:00+08:00",
      "reliability_tier": "secondary",
      "language": "en"
    }
  ],
  "metrics": [
    {
      "metric_id": "MET-001",
      "name": {
        "zh_CN": "营业收入（2022财年）",
        "en_AU": "Revenue (FY2022)"
      },
      "value": 2890000000.0,
      "unit": "CNY",
      "currency": "CNY",
      "period": "FY2022",
      "as_of_date": "2022-12-31",
      "source_id": "SRC-001",
      "source_url_or_document": "upload://mock-annual-report-2025.pdf#p102",
      "retrieved_at": "2026-07-10T09:00:00+08:00",
      "computed_by": "provider"
    },
    {
      "metric_id": "MET-002",
      "name": {
        "zh_CN": "营业收入（2023财年）",
        "en_AU": "Revenue (FY2023)"
      },
      "value": 3260000000.0,
      "unit": "CNY",
      "currency": "CNY",
      "period": "FY2023",
      "as_of_date": "2023-12-31",
      "source_id": "SRC-001",
      "source_url_or_document": "upload://mock-annual-report-2025.pdf#p102",
      "retrieved_at": "2026-07-10T09:00:00+08:00",
      "computed_by": "provider"
    },
    {
      "metric_id": "MET-003",
      "name": {
        "zh_CN": "营业收入（2024财年）",
        "en_AU": "Revenue (FY2024)"
      },
      "value": 3760000000.0,
      "unit": "CNY",
      "currency": "CNY",
      "period": "FY2024",
      "as_of_date": "2024-12-31",
      "source_id": "SRC-001",
      "source_url_or_document": "upload://mock-annual-report-2025.pdf#p102",
      "retrieved_at": "2026-07-10T09:00:00+08:00",
      "computed_by": "provider"
    },
    {
      "metric_id": "MET-004",
      "name": {
        "zh_CN": "营业收入（2025财年）",
        "en_AU": "Revenue (FY2025)"
      },
      "value": 4520000000.0,
      "unit": "CNY",
      "currency": "CNY",
      "period": "FY2025",
      "as_of_date": "2025-12-31",
      "source_id": "SRC-001",
      "source_url_or_document": "upload://mock-annual-report-2025.pdf#p102",
      "retrieved_at": "2026-07-10T09:00:00+08:00",
      "computed_by": "provider"
    },
    {
      "metric_id": "MET-005",
      "name": {
        "zh_CN": "归母净利润（2022财年）",
        "en_AU": "Net profit (FY2022)"
      },
      "value": 280000000.0,
      "unit": "CNY",
      "currency": "CNY",
      "period": "FY2022",
      "as_of_date": "2022-12-31",
      "source_id": "SRC-001",
      "source_url_or_document": "upload://mock-annual-report-2025.pdf#p102",
      "retrieved_at": "2026-07-10T09:00:00+08:00",
      "computed_by": "provider"
    },
    {
      "metric_id": "MET-006",
      "name": {
        "zh_CN": "归母净利润（2023财年）",
        "en_AU": "Net profit (FY2023)"
      },
      "value": 340000000.0,
      "unit": "CNY",
      "currency": "CNY",
      "period": "FY2023",
      "as_of_date": "2023-12-31",
      "source_id": "SRC-001",
      "source_url_or_document": "upload://mock-annual-report-2025.pdf#p102",
      "retrieved_at": "2026-07-10T09:00:00+08:00",
      "computed_by": "provider"
    },
    {
      "metric_id": "MET-007",
      "name": {
        "zh_CN": "归母净利润（2024财年）",
        "en_AU": "Net profit (FY2024)"
      },
      "value": 410000000.0,
      "unit": "CNY",
      "currency": "CNY",
      "period": "FY2024",
      "as_of_date": "2024-12-31",
      "source_id": "SRC-001",
      "source_url_or_document": "upload://mock-annual-report-2025.pdf#p102",
      "retrieved_at": "2026-07-10T09:00:00+08:00",
      "computed_by": "provider"
    },
    {
      "metric_id": "MET-008",
      "name": {
        "zh_CN": "归母净利润（2025财年）",
        "en_AU": "Net profit (FY2025)"
      },
      "value": 512000000.0,
      "unit": "CNY",
      "currency": "CNY",
      "period": "FY2025",
      "as_of_date": "2025-12-31",
      "source_id": "SRC-001",
      "source_url_or_document": "upload://mock-annual-report-2025.pdf#p102",
      "retrieved_at": "2026-07-10T09:00:00+08:00",
      "computed_by": "provider"
    },
    {
      "metric_id": "MET-009",
      "name": {
        "zh_CN": "营业收入同比增速（2025财年）",
        "en_AU": "Revenue growth YoY (FY2025)"
      },
      "value": 20.2,
      "unit": "%",
      "currency": null,
      "period": "FY2025",
      "as_of_date": "2025-12-31",
      "source_id": "SRC-001",
      "source_url_or_document": "upload://mock-annual-report-2025.pdf#p102",
      "retrieved_at": "2026-07-10T09:00:00+08:00",
      "computed_by": "deterministic_calc",
      "calculation": {
        "formula": "(MET-004 / MET-003 - 1) * 100",
        "input_metric_ids": [
          "MET-004",
          "MET-003"
        ]
      }
    },
    {
      "metric_id": "MET-010",
      "name": {
        "zh_CN": "净利率（2025财年）",
        "en_AU": "Net margin (FY2025)"
      },
      "value": 11.3,
      "unit": "%",
      "currency": null,
      "period": "FY2025",
      "as_of_date": "2025-12-31",
      "source_id": "SRC-001",
      "source_url_or_document": "upload://mock-annual-report-2025.pdf#p102",
      "retrieved_at": "2026-07-10T09:00:00+08:00",
      "computed_by": "deterministic_calc",
      "calculation": {
        "formula": "MET-008 / MET-004 * 100",
        "input_metric_ids": [
          "MET-008",
          "MET-004"
        ]
      }
    },
    {
      "metric_id": "MET-011",
      "name": {
        "zh_CN": "智能装备收入（2025财年）",
        "en_AU": "Intelligent equipment revenue (FY2025)"
      },
      "value": 2710000000.0,
      "unit": "CNY",
      "currency": "CNY",
      "period": "FY2025",
      "as_of_date": "2025-12-31",
      "source_id": "SRC-001",
      "source_url_or_document": "upload://mock-annual-report-2025.pdf#p102",
      "retrieved_at": "2026-07-10T09:00:00+08:00",
      "computed_by": "provider"
    },
    {
      "metric_id": "MET-012",
      "name": {
        "zh_CN": "自动化部件收入（2025财年）",
        "en_AU": "Automation components revenue (FY2025)"
      },
      "value": 1360000000.0,
      "unit": "CNY",
      "currency": "CNY",
      "period": "FY2025",
      "as_of_date": "2025-12-31",
      "source_id": "SRC-001",
      "source_url_or_document": "upload://mock-annual-report-2025.pdf#p102",
      "retrieved_at": "2026-07-10T09:00:00+08:00",
      "computed_by": "provider"
    },
    {
      "metric_id": "MET-013",
      "name": {
        "zh_CN": "服务收入（2025财年）",
        "en_AU": "Services revenue (FY2025)"
      },
      "value": 450000000.0,
      "unit": "CNY",
      "currency": "CNY",
      "period": "FY2025",
      "as_of_date": "2025-12-31",
      "source_id": "SRC-001",
      "source_url_or_document": "upload://mock-annual-report-2025.pdf#p102",
      "retrieved_at": "2026-07-10T09:00:00+08:00",
      "computed_by": "provider"
    },
    {
      "metric_id": "MET-032",
      "name": {
        "zh_CN": "智能装备收入（2024财年）",
        "en_AU": "Intelligent equipment revenue (FY2024)"
      },
      "value": 2330000000.0,
      "unit": "CNY",
      "currency": "CNY",
      "period": "FY2024",
      "as_of_date": "2024-12-31",
      "source_id": "SRC-001",
      "source_url_or_document": "upload://mock-annual-report-2025.pdf#p102",
      "retrieved_at": "2026-07-10T09:00:00+08:00",
      "computed_by": "provider"
    },
    {
      "metric_id": "MET-033",
      "name": {
        "zh_CN": "自动化部件收入（2024财年）",